{"familyId":"design_interview","freeNodeId":"requirements_user_journeys_constraints_and_frontend_decomposition","itemCount":150,"items":[{"id":"fesd-n01-b01-i001","itemFingerprint":"8afd41f3f358029daf24490f0a1c0183e00bc2a7e9fbe4d458db28d17ccb9807"},{"id":"fesd-n01-b01-i002","itemFingerprint":"76d980454c1534ccc43f26885fd89a0c342024afebfae76f5257cac88a49fec5"},{"id":"fesd-n01-b01-i003","itemFingerprint":"47c17b487f111dc7926d21dcfbb0f41fb8fac2758f55d79906583c053ad720ff"},{"id":"fesd-n01-b01-i004","itemFingerprint":"7e02de957dc5636be279da9b8397063a07d69e62412880ed858de99085a0f243"},{"id":"fesd-n01-b01-i005","itemFingerprint":"c24a1c58b453da1e067faf526b45cfa5ed7dc8f30fdf86711feb6e0198fa1892"},{"id":"fesd-n01-b01-i006","itemFingerprint":"886cd6eb64bf3af6a2c31d64077d263c40bbb9cde9885eae699887b98137311a"},{"id":"fesd-n01-b01-i007","itemFingerprint":"5e2001737c981bf421647778d88060fe2bc6a3bb8e3fb59450c127eff0529435"},{"id":"fesd-n01-b01-i008","itemFingerprint":"b61f74fa5b04c553cd7087a6a99be1834e6df4d77229eb05220fbc4b61d67700"},{"id":"fesd-n01-b01-i009","itemFingerprint":"dc48240668844f09622cb1fb1db1ddb322d28d4dd49f6005191ba871a2b4fab6"},{"id":"fesd-n01-b01-i010","itemFingerprint":"35b22bc50564e14863a4df1afdac454da6dbd4d51dc76b477e1e9291b81424e0"},{"id":"fesd-n01-b01-i011","itemFingerprint":"05cbfc1e6360ff37483597fa6333ae90944005ddf3c5a3aa36049f6df7c5b6b4"},{"id":"fesd-n01-b01-i012","itemFingerprint":"4e7ebf1d91b983344315475d3033dea852c9476681cc9cc4a443e9aa72416cb5"},{"id":"fesd-n01-b01-i013","itemFingerprint":"24c33404eb007c500a39721264ccae31a8a1b8bb3533b344458fe2f90c53cd46"},{"id":"fesd-n01-b01-i014","itemFingerprint":"e3207f8143b24c7187f6dd270f29ccaed4dbe089c8278b3d2941dac10bb6ecb3"},{"id":"fesd-n01-b01-i015","itemFingerprint":"94e4d96e67d50b8cb333d95f002edc21d2a9545829e913da996a3ea9901fafab"},{"id":"fesd-n01-b01-i016","itemFingerprint":"d6ac6c75a21b27a01b3496d031f1d9e644614b4a31baa9ec4f13ee637f7affc7"},{"id":"fesd-n01-b01-i017","itemFingerprint":"45cd834825693279f4e45247f2af40daa8b9a89c03d34da316da1e487f03337a"},{"id":"fesd-n01-b01-i018","itemFingerprint":"02e1c50e8386017f0114b8be7cbb7e84339e5a445ba75efd53b7a7ca08455e77"},{"id":"fesd-n01-b01-i019","itemFingerprint":"90c512b8ede2abf7060699878434dad0b043e569f97dd18e2c6f2cda46131f62"},{"id":"fesd-n01-b02-i001","itemFingerprint":"958b42aba97a1d1549c7ab510d522f7e3925d0b5cdd23e7a564e0731bba03400"},{"id":"fesd-n01-b02-i002","itemFingerprint":"c4406f13d98f004dcd8a94d0f4879d8b66f87376cc9fdc35ca10c4bb5b0d1d5d"},{"id":"fesd-n01-b02-i003","itemFingerprint":"f9e1736c23a53a7da9e42bc62b9e28ee9b921f1b0d1e5dfc4bb2c4d06271b5ec"},{"id":"fesd-n01-b02-i004","itemFingerprint":"306401d8def406ca17c0a0b8089ed702c0832076cfef2654bf720c8e75c31d96"},{"id":"fesd-n01-b02-i005","itemFingerprint":"d0e692adb020be3c9c7c208fbb292dbe271cc4782bfb0d235b2a9bd44f81723b"},{"id":"fesd-n01-b02-i006","itemFingerprint":"b08b9e21ad1c708a1368bf82ed921b71c2bcdaa6015e332391b184b11d8a6f9c"},{"id":"fesd-n01-b02-i007","itemFingerprint":"9a87ab0896f920e3f2ad3dfac622019fc34006d12cce2d835d03c2ea43f9c2b0"},{"id":"fesd-n01-b02-i008","itemFingerprint":"155995e30f41eb87430ed46026d464f3560905f4e6df72750c0f32e063d9a126"},{"id":"fesd-n01-b02-i009","itemFingerprint":"cec94bcc2a5fb1065513f20408295a5e78e0ece1e6260b42573863ceff81f7f4"},{"id":"fesd-n01-b02-i010","itemFingerprint":"c9dbbf4f1bc816cab50a56528c8b160e5cb92b5e99a190f3d05b5b91c7dadd44"},{"id":"fesd-n01-b02-i011","itemFingerprint":"29bb983229124c31a2b2bc7de02ba7bec04624989ad02719abc75f67afddc45a"},{"id":"fesd-n01-b02-i012","itemFingerprint":"d71e274be03fa6dcf0da4388f3d1277d533f1e8defcbcd5ff8946fac54114091"},{"id":"fesd-n01-b02-i013","itemFingerprint":"064031b6485c1917bd584b7bf0c0446974033273f20fa73a51cf4affab65e075"},{"id":"fesd-n01-b02-i014","itemFingerprint":"c972482d7abf98580e1c3daad74fa7832a5567a73f643c2b94452d2bb1f839fa"},{"id":"fesd-n01-b02-i015","itemFingerprint":"40911e7a6c586c6bd6cb376dd15be6dd26941f5a4db5bce58a46b8f1bf76d122"},{"id":"fesd-n01-b02-i016","itemFingerprint":"b69f47eebc1c38ea1df2ba51bda61e3e1f5df3f7f5642c3f60b4a0b4f8a4927f"},{"id":"fesd-n01-b02-i017","itemFingerprint":"ce608e433ac8371d38ea0f5d44bbce217624430d45566626f61989d1c4ee646e"},{"id":"fesd-n01-b02-i018","itemFingerprint":"a7cb916d36ef80aa2a4cfe0c8ceaf8be786bf64fdbf030e2db7315e60f4b46c2"},{"id":"fesd-n01-b02-i019","itemFingerprint":"e8dd2922c8576ec9a9ef166844dbfc474ee7b32acf9638bf1194534b88825752"},{"id":"fesd-n01-b02-i020","itemFingerprint":"13b72417dfc80045fbb478bf9292a052e488371702edec11d33c66f9df16e81d"},{"id":"fesd-n01-b03-i001","itemFingerprint":"54e53791fd6b4657516a7b3d9f92eee3fe6ab8ae359411652d7ec803f3fe2d9b"},{"id":"fesd-n01-b03-i002","itemFingerprint":"9ffbfbcd2ff7434ed9275bf4046b59ecead3df39260a94dc97b3f4dc7ee4e76e"},{"id":"fesd-n01-b03-i003","itemFingerprint":"a124cdd20002367c606792f2771281c1774094ba69b8a7bf65e9fbd856612e17"},{"id":"fesd-n01-b03-i004","itemFingerprint":"d7396f775e1ed6167a649cec9b4ac0bd19e312be6b7dd4000247e2ec0c195829"},{"id":"fesd-n01-b03-i005","itemFingerprint":"598c8022ffd2378140036e5afe90a50162f6b258aa9c912fe2000e11fc075ffb"},{"id":"fesd-n01-b03-i006","itemFingerprint":"0458f7eef88804f4071cca399a813af7155f749ebab5d255f78668f931c149e0"},{"id":"fesd-n01-b03-i007","itemFingerprint":"6b51f1b2957346626d91288adf990aca486fda6f981821f61c5ab84aaaf2ff1f"},{"id":"fesd-n01-b03-i008","itemFingerprint":"f02f3653df20e362297e2c57a081ca75afae705093380212945ffbc76bc5f115"},{"id":"fesd-n01-b03-i009","itemFingerprint":"7f71f16ae0602f5bc00e1d497e6abc8c75ce67fb8d17032e46285caab23b2349"},{"id":"fesd-n01-b03-i010","itemFingerprint":"2afb1fc5d940dc7a89deb46f1580bd6f4d202c46a8a9db9c297d5c5c3c34bcf4"},{"id":"fesd-n01-b03-i011","itemFingerprint":"5e6087ea8ce49c60e30d3e713b7f14951cea8d9c4ad94004b4baef10fb1bb932"},{"id":"fesd-n01-b03-i012","itemFingerprint":"cbf7932aec69b6206d6251bd3478c7371342848f9bf93f549de82bdd06961009"},{"id":"fesd-n01-b03-i013","itemFingerprint":"8524fd192b8faff3d5b2f07c75527cbf01c81af0d8a5483fb6829ab20c8927b5"},{"id":"fesd-n01-b03-i014","itemFingerprint":"0e6101cca8b2ae0c3164befe589e0a6fb9d21cb9a15df41528fdf8fd8b5582c7"},{"id":"fesd-n01-b03-i015","itemFingerprint":"9e3421e968c4cfe6bfb5c32713fe8f1bed22da4c188f734b4d2cecbaaf310c0e"},{"id":"fesd-n01-b03-i016","itemFingerprint":"cfc70ccc774e3c8f93a666044e30b954e84b283d1de6e5c4cdf85157b2a07e51"},{"id":"fesd-n01-b03-i017","itemFingerprint":"d28f7c6e82bb4f2d31ce1329f1d4abcb54db4df63be4914721513f60f4828bc6"},{"id":"fesd-n01-b03-i018","itemFingerprint":"bb512f05c1f0b0f851d50fbfaf2979480f5d870060ccc3c13fc2cba9343fd7f6"},{"id":"fesd-n01-b04-i001","itemFingerprint":"34559c2a22da687371ed9ed83f22d0b0075ac414d0c7c0564e3c45aee32a638b"},{"id":"fesd-n01-b04-i002","itemFingerprint":"d83180e165597e9bcceaf44679d3393ce02dddab56c9d6728447a3cb3281259d"},{"id":"fesd-n01-b04-i003","itemFingerprint":"fbed039d4702cf2acf1c6e42b9d0b5c52a989048eeb82ec16cef56c6a7e2037b"},{"id":"fesd-n01-b04-i004","itemFingerprint":"aa4b0394d3e82aa6c4cf22457cf94a1487999d0001e02e77c92f13559b8894ba"},{"id":"fesd-n01-b04-i005","itemFingerprint":"bf8fb690eb08d1659cc0d21dfae16a9395cfdd9b8fabbb68f23c16596464567c"},{"id":"fesd-n01-b04-i006","itemFingerprint":"e4a822056c28ddbd682822b7df2ba9564eb36884089f22f841234d83ce9755b1"},{"id":"fesd-n01-b04-i007","itemFingerprint":"3f5b8b99ab3c35c1b9718a01ea4684a144aff4a89dfbfa6a840931281b15e893"},{"id":"fesd-n01-b04-i008","itemFingerprint":"7986003fb6f78dcd74aa3d024a40dcfe61fd635e63ee4665c957ea42e60529b1"},{"id":"fesd-n01-b04-i009","itemFingerprint":"2c96b8700d21c74d3c5f55d8af9fb33e2920c7d7853ef6947e431ca445b77b10"},{"id":"fesd-n01-b04-i010","itemFingerprint":"5c929493361954c24b28025a2f5f875168a9a1917fd37b5a958d10f80277086f"},{"id":"fesd-n01-b04-i011","itemFingerprint":"6f910a4d3daafb5f737459de5af3618bd7cc29251494befb74fc17eaa257e7a3"},{"id":"fesd-n01-b04-i012","itemFingerprint":"eccb87810ee9d5bcd872412ba6d04ca9252885db1c600168b038d71c7e7b4ad1"},{"id":"fesd-n01-b04-i013","itemFingerprint":"7c778d3719e6873a4c6e7a18b4543c6079e807c5df3b61b632289298b214d514"},{"id":"fesd-n01-b04-i014","itemFingerprint":"789287cd80c351ba4c1822f1ecc2719f8d840a7d9ca53cdb8f471978c268663a"},{"id":"fesd-n01-b04-i015","itemFingerprint":"558d002ec2f390638e1494d906a9bbefd1257c38c1f9ad2559894b25f98033da"},{"id":"fesd-n01-b04-i016","itemFingerprint":"9319c18900e46df1598bc3c59561e465c3538d56b5aec51993d468adb456926c"},{"id":"fesd-n01-b04-i017","itemFingerprint":"b5ef968ae6fd2d05cd82b2e2115f8425504a15823c65cedc081143c9322ef06d"},{"id":"fesd-n01-b04-i018","itemFingerprint":"983264c4569ac322f6c81561280c0fd9bd2decf1e919a8c873c179d4c76896ef"},{"id":"fesd-n01-b05-i001","itemFingerprint":"05d72d80dca18f33052506ec6194528f79dc6267d29bbc0ce313d80c8f2aa291"},{"id":"fesd-n01-b05-i002","itemFingerprint":"aec967ab5b0323927b1468f9a1921214743073e22f00654d67f29da0a3265e6e"},{"id":"fesd-n01-b05-i003","itemFingerprint":"ce705ea344405ed0d592cd1e16b16e9a565dba113d0cbb44afa40eaec7d3d58c"},{"id":"fesd-n01-b05-i004","itemFingerprint":"7ca92d9cb3c3caef259ec772d2d284aac397151652e6d2a14da772eeef617813"},{"id":"fesd-n01-b05-i005","itemFingerprint":"56d0f67c2fa93a67a908b95ef94abdc2a2e8dc13b49f75133ba79ea3cd877b50"},{"id":"fesd-n01-b05-i006","itemFingerprint":"81d795da5c1550d309628acd1922e6cf8d6574abe9924eafd97cf8624369067e"},{"id":"fesd-n01-b05-i007","itemFingerprint":"a91adcf1f390812eb86eb0e4f458c4796a02d5b5800648b134a2e2f169fba528"},{"id":"fesd-n01-b05-i008","itemFingerprint":"b8a6833c285bf898eb18391ac521be66e5d9cfa72c1130868e49bab359abe4d0"},{"id":"fesd-n01-b05-i009","itemFingerprint":"bbe14129693d1fc0a4496f883b9006f58b84c96ce5201a80ad8f91b69e542a81"},{"id":"fesd-n01-b05-i010","itemFingerprint":"63b0c794f33b2e539a14c731c4d83c021c819152253542520615320d766f061c"},{"id":"fesd-n01-b05-i011","itemFingerprint":"f2838ec33343bbb38eb0f4d746e0242726f9cc1740cbe0483a06540451f2fefc"},{"id":"fesd-n01-b05-i012","itemFingerprint":"d5fbc272175611dca0521ffe3d833197a9b0ce0b3de529f08c21d225afa38c47"},{"id":"fesd-n01-b05-i013","itemFingerprint":"ce516f35f6828af6c29398d27d12dfeefff2fd596ad583bb5b1631511e925fec"},{"id":"